### ISSUE TITLE
ubridge not working when gns3server bound to specific IP

### ISSUE THREAD

**Issue by candlerb** [GNS3/gns3-server#1802]
This is with `gns3-server 2.2.11~bionic1` under Ubuntu 18.04

I have renumbered virbr0 from its default 192.168.122.1 to 100.64.0.1, and then bound the gns3server to this IP in `~/.config/GNS3/2.2/gns3_server.conf`

```
[Server]
host = 100.64.0.1
```

When I start a VM under GNS3, packet forwarding between the VM interface and the host bridge is not working(*).  This appears to be down to a problem with ubridge, since strace on ubridge shows "ECONNREFUSED" repeatedly:

```
nsrc@brian-kit:~$ ps auxwww | grep ubridge
nsrc     17407  0.0  0.0  99200  1032 ?        Sl   13:08   0:00 /usr/bin/ubridge -H 100.64.0.1:34289
nsrc     17471  0.0  0.0  99200   960 ?        Sl   13:08   0:00 /usr/bin/ubridge -H 100.64.0.1:39453
nsrc     17814  0.0  0.0  14428  1048 pts/1    S+   13:13   0:00 grep --color=auto ubridge
nsrc@brian-kit:~$ sudo netstat -natp | grep ubridge
tcp        0      0 100.64.0.1:34289        0.0.0.0:*               LISTEN      17407/ubridge
tcp        0      0 100.64.0.1:39453        0.0.0.0:*               LISTEN      17471/ubridge
tcp        0      0 100.64.0.1:39453        10.12.253.2:41296       ESTABLISHED 17471/ubridge
tcp        0      0 100.64.0.1:34289        10.12.253.2:40124       ESTABLISHED 17407/ubridge
nsrc@brian-kit:~$ sudo netstat -naup | grep ubridge
udp        0      0 100.64.0.1:20000        100.64.0.1:20001        ESTABLISHED 17471/ubridge
udp        0      0 100.64.0.1:20001        100.64.0.1:20000        ESTABLISHED 17407/ubridge
udp        0      0 127.0.0.1:20003         127.0.0.1:20002         ESTABLISHED 17471/ubridge

(Note: 10.12.253.2 is the client machine where gns3-gui is running)

nsrc@brian-kit:~$ sudo strace -f -p 17407 -s 128
strace: Process 17407 attached with 4 threads
[pid 17407] select(4, [3], NULL, NULL, {tv_sec=0, tv_usec=131959} <unfinished ...>
[pid 17415] read(6,  <unfinished ...>
[pid 17408] read(4,  <unfinished ...>
[pid 17414] recvfrom(5,  <unfinished ...>
[pid 17407] <... select resumed> )      = 0 (Timeout)
[pid 17407] select(4, [3], NULL, NULL, {tv_sec=0, tv_usec=500000}) = 0 (Timeout)
[pid 17407] select(4, [3], NULL, NULL, {tv_sec=0, tv_usec=500000} <unfinished ...>
[pid 17415] <... read resumed> "\1\200\302\0\0\0\240\4`&O\370\0'BB\3\0\0\2\2>@\0d\321T[\342\340\0\0N `\0\240\4`&O\366\200\3\1\0\24\0\2\0\17\0\0\0\0\0\0\0\0\0", 65535) = 60
[pid 17415] sendto(5, "\1\200\302\0\0\0\240\4`&O\370\0'BB\3\0\0\2\2>@\0d\321T[\342\340\0\0N `\0\240\4`&O\366\200\3\1\0\24\0\2\0\17\0\0\0\0\0\0\0\0\0", 60, 0, NULL, 0) = 60
[pid 17414] <... recvfrom resumed> 0x7f896ffeeea0, 65535, 0, NULL, NULL) = -1 ECONNREFUSED (Connection refused)
[pid 17415] read(6,  <unfinished ...>
[pid 17414] recvfrom(5,  <unfinished ...>
[pid 17407] <... select resumed> )      = 0 (Timeout)
[pid 17407] select(4, [3], NULL, NULL, {tv_sec=0, tv_usec=500000} <unfinished ...>
[pid 17415] <... read resumed> "33\0\0\203\204RT\0\3369\233\206\335`\17\250#\1H\21\1\376\200\0\0\0\0\0\0PT\0\377\376\3369\233\377\22\0\0\0\0\0\0\0\0\0\0\0\0\203\204\261*R#\1H\255C.\247\331\v\n 3\227\343\333\241\335\3434\3358\251\271\271\r\240a\320s\31\233\r\3637\220\7U\214\7\353bdx\22\24quic://0.0.0.0:22000\22\33quic"..., 65535) = 382
[pid 17415] sendto(5, "33\0\0\203\204RT\0\3369\233\206\335`\17\250#\1H\21\1\376\200\0\0\0\0\0\0PT\0\377\376\3369\233\377\22\0\0\0\0\0\0\0\0\0\0\0\0\203\204\261*R#\1H\255C.\247\331\v\n 3\227\343\333\241\335\3434\3358\251\271\271\r\240a\320s\31\233\r\3637\220\7U\214\7\353bdx\22\24quic://0.0.0.0:22000\22\33quic"..., 382, 0, NULL, 0) = 382
[pid 17414] <... recvfrom resumed> 0x7f896ffeeea0, 65535, 0, NULL, NULL) = -1 ECONNREFUSED (Connection refused)
[pid 17414] recvfrom(5,  <unfinished ...>
[pid 17415] read(6, "33\0\0\203\204\362\1\32\352\357=\206\335`\10\333\236\1H\21\1\376\200\0\0\0\0\0\0\360\1\32\377\376\352\357=\377\22\0\0\0\0\0\0\0\0\0\0\0\0\203\204\261*R#\1H=\347.\247\331\v\n 3\227\343\333\241\335\3434\3358\251\271\271\r\240a\320s\31\233\r\3637\220\7U\214\7\353bdx\22\24quic://0.0.0.0:22000\22\33quic"..., 65535) = 382
[pid 17415] sendto(5, "33\0\0\203\204\362\1\32\352\357=\206\335`\10\333\236\1H\21\1\376\200\0\0\0\0\0\0\360\1\32\377\376\352\357=\377\22\0\0\0\0\0\0\0\0\0\0\0\0\203\204\261*R#\1H=\347.\247\331\v\n 3\227\343\333\241\335\3434\3358\251\271\271\r\240a\320s\31\233\r\3637\220\7U\214\7\353bdx\22\24quic://0.0.0.0:22000\22\33quic"..., 382, 0, NULL, 0) = 382
[pid 17414] <... recvfrom resumed> 0x7f896ffeeea0, 65535, 0, NULL, NULL) = -1 ECONNREFUSED (Connection refused)
[pid 17414] recvfrom(5,  <unfinished ...>
^C

nsrc@brian-kit:~$ sudo strace -f -p 17471 -s 128
strace: Process 17471 attached with 4 threads
[pid 17471] select(4, [3], NULL, NULL, {tv_sec=0, tv_usec=493092} <unfinished ...>
[pid 17483] recvfrom(6,  <unfinished ...>
[pid 17482] recvfrom(5,  <unfinished ...>
[pid 17481] read(4,  <unfinished ...>
[pid 17482] <... recvfrom resumed> "\377\377\377\377\377\377\32\204n\210|G\10\6\0\1\10\0\6\4\0\1\32\204n\210|Gd@\0\372\0\0\0\0\0\0d@\0\1", 65535, 0, NULL, NULL) = 42
[pid 17482] sendto(6, "\377\377\377\377\377\377\32\204n\210|G\10\6\0\1\10\0\6\4\0\1\32\204n\210|Gd@\0\372\0\0\0\0\0\0d@\0\1", 42, 0, NULL, 0 <unfinished ...>
[pid 17483] <... recvfrom resumed> 0x7fdd76e56ea0, 65535, 0, NULL, NULL) = -1 ECONNREFUSED (Connection refused)
[pid 17482] <... sendto resumed> )      = 42
[pid 17483] recvfrom(6,  <unfinished ...>
[pid 17482] recvfrom(5,  <unfinished ...>
[pid 17471] <... select resumed> )      = 0 (Timeout)
[pid 17471] select(4, [3], NULL, NULL, {tv_sec=0, tv_usec=500000}) = 0 (Timeout)
[pid 17471] select(4, [3], NULL, NULL, {tv_sec=0, tv_usec=500000} <unfinished ...>
[pid 17482] <... recvfrom resumed> "\377\377\377\377\377\377\32\204n\210|G\10\6\0\1\10\0\6\4\0\1\32\204n\210|Gd@\0\372\0\0\0\0\0\0d@\0\1", 65535, 0, NULL, NULL) = 42
[pid 17482] sendto(6, "\377\377\377\377\377\377\32\204n\210|G\10\6\0\1\10\0\6\4\0\1\32\204n\210|Gd@\0\372\0\0\0\0\0\0d@\0\1", 42, 0, NULL, 0 <unfinished ...>
[pid 17483] <... recvfrom resumed> 0x7fdd76e56ea0, 65535, 0, NULL, NULL) = -1 ECONNREFUSED (Connection refused)
[pid 17482] <... sendto resumed> )      = 42
[pid 17483] recvfrom(6,  <unfinished ...>
[pid 17482] recvfrom(5,  <unfinished ...>
[pid 17471] <... select resumed> )      = 0 (Timeout)
[pid 17471] select(4, [3], NULL, NULL, {tv_sec=0, tv_usec=500000}) = 0 (Timeout)
[pid 17471] select(4, [3], NULL, NULL, {tv_sec=0, tv_usec=500000} <unfinished ...>
[pid 17482] <... recvfrom resumed> "\377\377\377\377\377\377\32\204n\210|G\10\6\0\1\10\0\6\4\0\1\32\204n\210|Gd@\0\372\0\0\0\0\0\0d@\0\1", 65535, 0, NULL, NULL) = 42
[pid 17482] sendto(6, "\377\377\377\377\377\377\32\204n\210|G\10\6\0\1\10\0\6\4\0\1\32\204n\210|Gd@\0\372\0\0\0\0\0\0d@\0\1", 42, 0, NULL, 0 <unfinished ...>
[pid 17483] <... recvfrom resumed> 0x7fdd76e56ea0, 65535, 0, NULL, NULL) = -1 ECONNREFUSED (Connection refused)
[pid 17482] <... sendto resumed> )      = 42
[pid 17483] recvfrom(6,  <unfinished ...>
[pid 17482] recvfrom(5,  <unfinished ...>
[pid 17471] <... select resumed> )      = 0 (Timeout)
[pid 17471] select(4, [3], NULL, NULL, {tv_sec=0, tv_usec=500000}
^C
```

It all works fine if I comment out `host = 100.64.0.1` from `gns3_server.conf`.  Traffic forwarding succeeds, and netstat shows instead:

```
$ sudo netstat -natp | grep ubridge
tcp        0      0 0.0.0.0:46341           0.0.0.0:*               LISTEN      16729/ubridge
tcp        0      0 0.0.0.0:42549           0.0.0.0:*               LISTEN      16665/ubridge
tcp        0      0 127.0.0.1:42549         127.0.0.1:56814         ESTABLISHED 16665/ubridge
tcp        0      0 127.0.0.1:46341         127.0.0.1:57536         ESTABLISHED 16729/ubridge
$ sudo netstat -naup | grep ubridge
udp        0      0 127.0.0.1:20000         127.0.0.1:20001         ESTABLISHED 16729/ubridge
udp        0      0 127.0.0.1:20001         127.0.0.1:20000         ESTABLISHED 16665/ubridge
udp        0      0 127.0.0.1:20003         127.0.0.1:20002         ESTABLISHED 16729/ubridge
```

-------

(*) Symptoms when packet forwarding not working:

Inside the VM which was started by gns3: I can see packets sent but not received.

```
sysadm@noc:~$ sudo arping 100.64.0.1
[sudo] password for sysadm: 
ARPING 100.64.0.1
Timeout
Timeout
Timeout
^C

sysadm@noc:~$ sudo tcpdump -i ens3 -nn
tcpdump: verbose output suppressed, use -v or -vv for full protocol decode
listening on ens3, link-type EN10MB (Ethernet), capture size 262144 bytes
12:11:46.416753 ARP, Request who-has 100.64.0.1 tell 100.64.0.250, length 28
12:11:47.440743 ARP, Request who-has 100.64.0.1 tell 100.64.0.250, length 28
12:11:48.464830 ARP, Request who-has 100.64.0.1 tell 100.64.0.250, length 28
12:11:49.488750 ARP, Request who-has 100.64.0.1 tell 100.64.0.250, length 28
^C
```

On the host:

```
nsrc@brian-kit:~$ brctl show virbr0
bridge name	bridge id		STP enabled	interfaces
virbr0		8000.525400de399b	no		eno1
							gns3tap0-0
							virbr0-nic
```

tcpdump on virbr0 or gns3tap0-0 shows no traffic, apart from STP packets sent by virbr0 itself.

```
nsrc@brian-kit:~$ sudo tcpdump -i gns3tap0-0 -nn
tcpdump: verbose output suppressed, use -v or -vv for full protocol decode
listening on gns3tap0-0, link-type EN10MB (Ethernet), capture size 262144 bytes
13:18:20.107347 STP 802.1w, Rapid STP, Flags [Proposal, Learn, Forward], bridge-id 6000.a0:04:60:26:4f:f6.8003, length 43
13:18:22.097502 STP 802.1w, Rapid STP, Flags [Proposal, Learn, Forward], bridge-id 6000.a0:04:60:26:4f:f6.8003, length 43
13:18:24.097710 STP 802.1w, Rapid STP, Flags [Proposal, Learn, Forward], bridge-id 6000.a0:04:60:26:4f:f6.8003, length 43
^C
```
